
2021,MATX34ZL,Probability and Statistics,劉 言,基幹,春学期,金5時限,52-104,Note: The eligible year for EBSE September enrollees is different from the......
2021,MATX24ZL,Foundations of Statistics A,劉 言,基幹,春学期,金5時限,52-104,Note: The eligible year for EBSE September enrollees is different from the......
2021,MATX24ZL,Foundations of Statistics A,劉 言,基幹,春学期,金5時限,52-104,Note: The eligible year for EBSE September enrollees is different from the......
2021,ADEX30ZW,設計製図II,芦澤 竜一/王 薪鵬/小林 恵吾/藤井 由理/古谷 誠章/保坂 猛/宮本 佳明/吉村 靖孝/渡邊 大志,創造,春学期,金3-5,01:54-B0101:54-B0201:54-B0301:54-B0401:56-10401:57-201,"設計製図IIは、建築学各分野で学習中の知識を統合する設計製図の中核となる。
......"
2021,MECX21ZL,プロジェクト・ベースド・ラーニングA,石井 裕之/小野田 弘士/草鹿 仁,創造,春学期,金5-6,63-201, 本科目は、機械工学における専門知識を活用する実践力の習得、構想力/問題解......
2021,CSTX26ZL,Structural Mechanics,佐藤 靖彦/田中 祐人,創造,春クォーター,01:水5時限02:金5時限,01:54-30402:54-304,"Studying calculation of cross-sectional properties, reaction, section forc......"
2021,CSTX33ZL,International Development and Planning,北野 尚宏,創造,春学期,金5時限,54-204,International development has been challenged by the global issues such as......
2021,CSTX26ZL,Structural Mechanics,佐藤 靖彦/田中 祐人,創造,春クォーター,01:水5時限02:金5時限,01:54-30402:54-304,"Studying calculation of cross-sectional properties, reaction, section forc......"
2021,CSTX33ZL,International Development and Planning,北野 尚宏,創造,春学期,金5時限,54-204,International development has been challenged by the global issues such as......
2021,CHMC10ZL,基礎化学A,鹿又 宣弘,先進,春クォーター,01:水6時限02:金5時限,01:52-20202:52-202,"この授業はWaseda Moodle を活用し,教室での対面授業とオンデマンド配信授業,......"
2021,CHMC10ZL,基礎化学B,石原 浩二,先進,夏クォーター,01:水6時限02:金5時限,01:52-20202:52-202, 大学の教養課程の化学の教科書は数多く出版されているが、頁数の制約のためか......
2021,MEDG30ZL,Developmental Biology and Genetics,大島 登志男/佐藤 政充,先進,春学期,金5時限,54-202,Firsst 5 lectures are for Developmental Biology and Second 7 lectures are ......
2021,ELCX20ZS,回路理論A・演習 1クラス,近藤 圭一郎,先進,春学期,金5時限,52-302,回路理論Aのコンセプト、手法等を十分身につけるため、毎週演習を行う。最重要......
2021,ELCX20ZS,回路理論A・演習 2クラス,近藤 圭一郎,先進,春学期,金5時限,52-304,回路理論Aのコンセプト、手法等を十分身につけるため、毎週演習を行う。最重要......
2021,MEDG30ZL,Developmental Biology and Genetics,大島 登志男/佐藤 政充,先進,春学期,金5時限,54-202,Firsst 5 lectures are for Developmental Biology and Second 7 lectures are ......
2021,CSTX63ZL,International Development and Planning,北野 尚宏,創造研,春学期,金5時限,54-204,International development has been challenged by the global issues such as......
