
2021,MATX31ZL,代数学B1,成田 宏秋,基幹,春学期,金2時限,52-302,"代数学B1,B2はガロワ理論について解説することが目標になる。ガロワ理論は今日......"
2021,MECX22ZL,工学系の解析設計演習,齋藤 潔/ジャンネッティ ニコロ/山口 誠一/吉村 浩明/ヴァレラ リチャード ジェイソン,基幹,春学期,金1-2,63-201,"授業は,基本は対面で実施します.注意してください.なお,コロナ感染症拡大時......"
2021,PHYA30ZL,既約表現論,小山 泰正,基幹,春学期,金2時限,52-202, 原子、分子、および固体での電子状態等は、これらが持つ幾何学的な対称性に直......
2021,MATX32ZL,Geometry A,ゲスト マーティン,基幹,春学期,金2時限,54-402,Note: The eligible year for EBSE September enrollees is different from the......
2021,ADEX28ZW,建築工学実験A,位田 達哉/大坪 康郎/輿石 直幸/山田 宮土理,創造,春学期,金1-2,52-301,木材・コンクリートおよび鉄鋼材料を対象とし、その基本的な性質について日本産......
2021,ADEX27ZW,建築工学実験B,鵜飼 真成/高口 洋人/田邉 新一/中野 淳太/伯耆原 智世,創造,春学期,金1-2,52-303,建築工学実験B(環境系実験)では、実験を通じて建築環境分野に関する理解を深......
2021,CSTX26ZL,構造力学C,小野 潔,創造,春学期,金2時限,57-201,"・構造力学Cは対面授業で実施する予定である.リアルタイム配信は実施しない.
......"
2021,CSTX36ZL,防災地盤工学,小峯 秀雄,創造,春学期,金2時限,53-201,地震や水害等の自然災害や建設工事に伴う地盤災害から社会基盤施設を守るための......
2021,CSTX34ZL,岩盤力学,古井 健二,創造,春学期,金2時限,54-202,Note: The eligible year for EBSE September enrollees is different from the......
2021,CSTX34ZL,Rock Mechanics,古井 健二,創造,春学期,金2時限,54-202,Note: The eligible year for EBSE September enrollees is different from the......
2021,PHYP45ZL,原子核物理学,鷹野 正利,先進,春学期,金2時限,54-302,原子核物理学全般に関する入門的講議を行う。 特に、核の静的性質(質量、大き......
2021,PHYP45ZL,原子核物理学,鷹野 正利,先進,春学期,金2時限,54-302,原子核物理学全般に関する入門的講議を行う。 特に、核の静的性質(質量、大き......
2021,CHMC33ZL,量子化学,中井 浩巳,先進,春学期,金2時限,52-101,分子の構造・物性・反応性・電子状態を解明するために、今日では広く分子軌道(......
2021,CHMA40ZL,触媒化学,関根 泰/比護 拓馬/松方 正彦,先進,春学期,金2時限,57-202,触媒化学は現代の化学および工業化学を志す者にとっては是非とも心得ていなけれ......
2021,CHMA30ZL,触媒化学,関根 泰/比護 拓馬/松方 正彦,先進,春学期,金2時限,57-202,触媒化学は現代の化学および工業化学を志す者にとっては是非とも心得ていなけれ......
2021,PHYP27ZL,Materials Physics A,蟹澤 聖/高山 あかり,先進,春学期,金2時限,54-304,Aiming to systematic study of the basic physics necessary for understandin......
2021,PHYP27ZL,Solid State Physics A,蟹澤 聖/高山 あかり,先進,春学期,金2時限,54-304,Aiming to systematic study of the basic physics necessary for understandin......
2021,PHYP65ZL,原子核概説,鷹野 正利,基幹研,春学期,金2時限,54-302,原子核物理学全般に関する入門的講議を行う。 特に、核の静的性質(質量、大き......
2021,PHYP65ZL,原子核概説,鷹野 正利,創造研,春学期,金2時限,54-302,原子核物理学全般に関する入門的講議を行う。 特に、核の静的性質(質量、大き......
2021,PHYP65ZL,原子核概説,鷹野 正利,先進研,春学期,金2時限,54-302,原子核物理学全般に関する入門的講議を行う。 特に、核の静的性質(質量、大き......
2021,MECX633L,熱エネルギー反応工学特論,草鹿 仁/周 ベイニ,環エネ研,春学期,金2時限,53-B03,"近年,自動車によるエネルギー環境問題が注目されている。本講義ではこのような......"
