
2021,LANE101F,"英語Reading（Language, Economics, and Politics）中級　１１組",川手ミヤジェイエフスカ　恩,政経,秋学期,01:月５時限02:木５時限,01:10-20602:10-201,"In the opinion of many, reading is the single most important skillrequired......"
2021,LANE101F,"英語Reading（Language, Economics, and Politics）準上級　１３組",増田　正子,政経,秋学期,01:月５時限02:木５時限,01:3-40102:3-405,"In the opinion of many, reading is the single most important skillrequired......"
2021,LANE201F,English Language Course (Business English)　１４,内野　泰子,政経,秋学期,01:月５時限02:木５時限,01:3-70202:3-702,　This course is intended for intermediate-level students who are interest......
2021,LANE201F,English Language Course (News English)　０７,宮崎　修二,政経,秋学期,01:月５時限02:木５時限,01:3-70902:3-502,　（1）News English is an appropriate tool to learn English communication.......
2021,LANE201F,English Language Course (News English)　１０,八木　斉子,政経,秋学期,01:月５時限02:木５時限,01:3-40602:3-304,     Students in this course will devote time and energy to improving thei......
2021,LANE201F,English Language Course (Regional Studies)　０６,フィールゼンド　テリー　キース,政経,秋学期,01:月５時限02:木５時限,01:10-20402:10-302,"This course will cover a wide range of topics on the UK, and will feature ......"
2021,LANE201F,English Seminar (Data Journalism and the News Media)　０３,クリスティー　スティーヴ・ジョン,政経,秋学期,月５時限,3-704,This course will explore the news media to analyze and gain insight into h......
2021,LANG101F,独語（中級）II　０１組,堀内　美江／ニッケル　フランク,政経,秋学期,01:月５時限02:水４時限,01:3-604(演習室)02:3-607(演習室),"○ 独語中級I（春学期）
　 「初級I」「初級II」で得た基礎的能力をもとに、それ......"
2021,LANG201F,インテンシブ独語（中級）II　０１組,荻野　静男／ウォルブリング　エファ／赤松　エンリコ,政経,秋学期,01:火４時限02:水４時限03:木４時限04:月５時限,01:3-607(演習室)02:3-80803:3-909実習室04:3-712(演習室),"○ 独語インテンシブ中級I（春学期）・インテンシブ中級II（秋学期）
　週4回の......"
2021,LANF101F,仏語（初級）II　０４組,北村　喜久子／Ｓ・シャルコフ,政経,秋学期,01:月５時限02:金３時限,01:10-30602:3-606,"初級Ⅰ・初級Ⅱ 

　週2コマのうち1コマでは、フランス語の文法を学び（日本人教......"
2021,LANE101F,"英語Reading（Language, Economics, and Politics）中級　１１組",川手ミヤジェイエフスカ　恩,政経,秋学期,01:月５時限02:木５時限,01:10-20602:10-201,"In the opinion of many, reading is the single most important skillrequired......"
2021,LANE101F,"英語Reading（Language, Economics, and Politics）準上級　１３組",増田　正子,政経,秋学期,01:月５時限02:木５時限,01:3-40102:3-405,"In the opinion of many, reading is the single most important skillrequired......"
2021,LANE201F,English Language Course (Business English)　１４,内野　泰子,政経,秋学期,01:月５時限02:木５時限,01:3-70202:3-702,　This course is intended for intermediate-level students who are interest......
2021,LANE201F,English Language Course (News English)　０７,宮崎　修二,政経,秋学期,01:月５時限02:木５時限,01:3-70902:3-502,　（1）News English is an appropriate tool to learn English communication.......
2021,LANE201F,English Language Course (News English)　１０,八木　斉子,政経,秋学期,01:月５時限02:木５時限,01:3-40602:3-304,     Students in this course will devote time and energy to improving thei......
2021,LANE201F,English Language Course (Regional Studies)　０６,フィールゼンド　テリー　キース,政経,秋学期,01:月５時限02:木５時限,01:10-20402:10-302,"This course will cover a wide range of topics on the UK, and will feature ......"
2021,LANE201F,English Seminar (Data Journalism and the News Media)　０３,クリスティー　スティーヴ・ジョン,政経,秋学期,月５時限,3-704,This course will explore the news media to analyze and gain insight into h......
2021,LANG101F,独語（中級）II　０１組,堀内　美江／ニッケル　フランク,政経,秋学期,01:月５時限02:水４時限,01:3-604(演習室)02:3-607(演習室),"○ 独語中級I（春学期）
　 「初級I」「初級II」で得た基礎的能力をもとに、それ......"
2021,LANG201F,インテンシブ独語（中級）II　０１組,荻野　静男／ウォルブリング　エファ／赤松　エンリコ,政経,秋学期,01:火４時限02:水４時限03:木４時限04:月５時限,01:3-607(演習室)02:3-80803:3-909実習室04:3-712(演習室),"○ 独語インテンシブ中級I（春学期）・インテンシブ中級II（秋学期）
　週4回の......"
2021,LANF101F,仏語（初級）II　０４組,北村　喜久子／Ｓ・シャルコフ,政経,秋学期,01:月５時限02:金３時限,01:10-30602:3-606,"初級Ⅰ・初級Ⅱ 

　週2コマのうち1コマでは、フランス語の文法を学び（日本人教......"
2021,LANF201F,インテンシブ仏語（中級）II　０１組,松浦　寛／佐道　直身／篠原　洋治／ブロッソー　シルヴィ,政経,秋学期,01:水３時限02:木５時限03:月５時限04:火３時限,01:10-20102:10-10603:10-40704:3-609(演習室),"インテンシブ中級Ⅰ・中級Ⅱ 
週4コマでフランス語を集中的に学びます。うち2コマ......"
2021,LANC101F,中国語（中級）II　０１組,大久保　洋子／陳　力衛,政経,秋学期,01:月５時限02:水２時限,01:3-40502:3-304,　政治経済学部には、下記の中国語科目が設置されている。中国語の発音、文法、......
2021,LANS101F,インテンシブ西語（初級）II　０１組,藤本　愛／Ｏ．Ｖ．パルマ／木下　雅夫／新谷　ロクサナ,政経,秋学期,01:水４時限02:月５時限03:火４時限04:金４時限,01:3-30602:3-50203:3-901(学部PCﾙｰﾑ)04:10-201,週４回の授業のうち２回は日本人教員、２回はネイティヴ教員が担当します。日常......
2021,LANS101F,西語（中級）II　０１組,木下　雅夫／バラソ　ビクトル,政経,秋学期,01:木５時限02:月５時限,01:3-70402:10-404,「初級I」「初級II」で得た基礎的能力をもとに、それをさらに発展させて用いる......
2021,POLX309S,政治学演習 II (仲内英三),仲内　英三,政経,秋学期,月５時限,3-605,　本年度は、19世紀後半から20世紀中葉にかけての英国とドイツの政治について、......
2021,POLX309S,政治学演習 II (川岸令和),川岸　令和,政経,秋学期,月５時限,3-703,　日本国憲法は、敗戦という現実がもたらした新しい時代の新秩序を構成すべく制......
2021,POLX309S,政治学演習 II (谷澤正嗣),谷澤　正嗣,政経,秋学期,月５時限,3-812(演習室),政治を語る際に用いられる重要な概念について分析しつつ、「権力とはどんな力か......
2021,POLX309S,政治学演習 II (河野勝),河野　勝,政経,秋学期,月５時限,3-601,　日本の政治を政治学的に考察する。往々にして、現代の日本政治を語る語り口は......
2021,POLX309S,政治学演習 II (栗崎周平),栗崎　周平,政経,秋学期,月５時限,3-402,国際政治、主に安全保障に関わる論点（国際紛争、平和構築、内戦、国際組織、国......
2021,POLX409S,政治学演習 IV  (国吉知樹),国吉　知樹,政経,秋学期,月５時限,3-602,このゼミでは現代日本の国際関係について実証分析の方法を学ぶ。秋学期は各自が......
2021,ECNE301L,経済学研究（先端技術の経済学）　０１,井上　智洋,政経,秋学期,月５時限,3-501,ＡＩ、IoT、ブロックチェーンなどの先端技術が経済にどのような影響を及ぼすか......
2021,ECNA399S,経済学演習 II (大湾秀雄),大湾　秀雄,政経,秋学期,月５時限,7-212,1チーム4名でパートナーとなった企業の抱える課題、問題意識を共有して頂いた上......
2021,ECNA499S,経済学演習 IV (白木三秀),白木　三秀,政経,秋学期,月５時限,3-202(CTLT Classroom2),　　経済社会では現在、短期的のみならず中長期的にも様々な変化が起こっている......
2021,ECNT499S,経済学演習 IV (荒木一法),荒木　一法,政経,秋学期,月５時限,3-304,各自のゼミ論文を作成にむけての研究を進めてもらいます。ゼミの時間は研究の進......
2021,ECNT499S,経済学演習 IV (田中久稔),田中　久稔,政経,秋学期,月５時限,3-201(CTLT Classroom1),この演習では，理論経済学および計量経済学を深く学ぶにあたって必要となる数学......
2021,ECNA499S,経済学演習 IV (有村俊秀),有村　俊秀,政経,秋学期,月５時限,3-802,　地球温暖化問題、エネルギー問題、大気汚染問題、廃棄物問題などの環境問題を......
2021,ECNA499S,経済学演習 IV (安達剛),安達　剛,政経,秋学期,月５時限,3-808,ミクロ経済学は知識ではなく思考の型であり、社会や日常生活の現場で活用できな......
2021,POLX339S,国際政治経済学演習 II (唐亮),唐　亮,政経,秋学期,月５時限,3-404,戦後のアジア各国は歴史、文化および政治経済体制に関して多様性を持ちながら、......
2021,POLX409S,国際政治経済学演習 IV (齋藤純一),齋藤　純一,政経,秋学期,月５時限,3-809,　このゼミでは、自由、平等、公共性、デモクラシー、社会保障、社会統合など近......
2021,ECNA499S,国際政治経済学演習 IV (深川由起子),深川　由起子,政経,秋学期,月５時限,3-606,Ⅲにおける卒業論文の関連テーマからさらに直接、議論や分析手法が参考になる先......
2021,HUMA110L,人間科学のための線形代数,坂田　裕,人科,秋学期,月５時限,101-206,線形代数は、人間科学における様々な数理的理論やデータ解析のための数学として......
2021,HUMA130L,データリテラシー II　01,布山　美慕,人科,秋学期,月５-６,100-210,　問題意識への答えを探り、課題に対する解決策を見出すためには、データに基づ......
2021,HUMA130L,データリテラシー II　02,澤山　郁夫,人科,秋学期,月５-６,100-117,　問題意識への答えを探り、課題に対する解決策を見出すためには、データに基づ......
2021,HUMA130L,データリテラシー II　03,白川　真裕,人科,秋学期,月５-６,100-116,　問題意識への答えを探り、課題に対する解決策を見出すためには、データに基づ......
2021,HUMA240W,疫学・保健福祉情報分析法 02,岩垣　穂大,人科,冬クォーター,月４-５,101-207,　人間集団で発生する種々の健康・福祉関連の問題解決のために必要な対策の立案......
2021,HUMA390S,専門ゼミII（極限環境生命科学）,赤沼　哲史,人科,秋学期,月５-６,100-305,　生物の初期進化と古代地球環境の推定、生物および生体分子の環境適応機構、あ......
2021,HUMA390S,専門ゼミII（認知神経科学）,大須　理英子,人科,秋学期,月５-６,100-302,　卒業研究の準備として、各自が興味を持ったテーマに関連する文献の調査、輪読......
2021,HUMA390S,専門ゼミII（ヘルスプロモーション）,辻内　琢也,人科,秋学期,月４-５,101-305,　東日本大震災および原子力発電所事故は、わが国の未来を考える上での極めて大......
2021,HUMA390S,専門ゼミII（社会医学）,扇原　淳,人科,秋学期,月５-６,101-332,この演習では，文献抄読およびフィールドワークを含む卒業研究の予備調査を通し......
2021,HUMA390S,専門ゼミII（生体計測学）,村岡　慶裕,人科,秋学期,月５-６,100-406,　文献検索・管理法などを学んだ後に、各自、関心を持った内容の文献を調査し、......
2021,HUMA390S,専門ゼミII（老年学）,加瀬　裕子,人科,秋学期,月５-６,101-304,　本演習では、研究テーマごとにプロジェクト・チームを作りフィールド調査を行......
2021,HUMA390S,専門ゼミII（健康福祉マネジメント）,松原　由美,人科,秋学期,月５-６,100-111,　この科目では、医療・介護・福祉事業などの主たる事業体である非営利組織の経......
2021,HUMA390S,専門ゼミII（健康福祉行政）,植村　尚史,人科,秋学期,月４-５,101-306,　本ゼミは、健康福祉政策を研究対象とする、政策研究分野の演習である。演習、......
2021,HUMA390S,専門ゼミII（パフォーマンス認知科学）,三浦　哲都,人科,秋学期,月５-６,100-406,　人間は太古より集団で音楽を奏で、共に踊ることで他者との絆を深めてきました......
2021,HUMA390S,専門ゼミII（日常記憶心理学）,杉森　絵里子,人科,秋学期,月５-６,100-S102,　関心テーマごとに関連文献を検索・講読し、それらをまとめたのち、実験計画を......
2021,HUMA390S,専門ゼミII（生態心理学）,三嶋　博之,人科,秋学期,月５-６,三嶋･野嶋実験室,　「総体としての人間」に影響を与える比較的マクロな機能的情報単位（「アフォ......
2021,HUMA390S,専門ゼミII（インストラクショナルデザイン）,向後　千春,人科,秋学期,月５-６,100-401,"　専門ゼミⅡ（秋）では、本研究を実施します。その上で、ミニ卒論（1,000字×40......"
2021,STAX102L,情報処理　06,川上　諒子,スポーツ,秋学期,月５時限,322端末室,　現在のネットワーク社会において、ネットワークの利用はもちろんのこと、情報......
2021,LAWH283L,スポーツ法,松本　泰介,スポーツ,秋学期,月５時限,79-205大教室,　スポーツ実務において発生している具体的な事例を題材としながら、スポーツ法......
2021,POLX622G,"政治哲学・思想史専門研究セミナーB(PS,J：稲村一隆)",稲村　一隆,政研,秋学期,月５時限,3-711(演習室),本授業は政治哲学、政治思想史を専門とする大学院生のための演習形式の授業です......
2021,POLX642G,"国際政治専門研究セミナーＢ(PS,J：中村英俊)",中村　英俊,政研,秋学期,月５時限,3-710,"春学期に引き続き、各自の研究報告を重ねてもらう。
　修士課程1年生については......"
2021,JOUX602G,放送ジャーナリズム専門研究セミナーＢ(J：金平茂紀),金平　茂紀,政研,秋学期,月５時限,3-705(演習室),春学期のゼミ内容を継承した形で、後期はより実践的なジャーナリズム研究を行い......
2021,JOUX643L,アジア文化研究(J：齊藤泰治),齊藤　泰治,政研,秋学期,月５時限,3-913実習室, 文化の接触、受容というものを理論的に考え、近代以降の日本とアジアとのかか......
2021,MDAX643L,情報法(J：山田健太),山田　健太,政研,秋学期,月５時限,3-914実習室,今日のメディアをめぐる状況は、テクノロジーの展開また民主主義理論や法意識の......
2021,POLX642G,国際政治専門研究セミナー(博士：中村英俊),中村　英俊,政研,秋学期,月５時限,3-710,"春学期に引き続き、各自の研究報告を重ねてもらう。
　修士課程1年生については......"
2021,POLX722G,政治哲学・思想史専門研究セミナー(博士：稲村一隆),稲村　一隆,政研,秋学期,月５時限,3-711(演習室),本授業は政治哲学、政治思想史を専門とする大学院生のための演習形式の授業です......
2021,POLX653L,"日本経済論(GP,PM：清水治)",清水　治,政研,秋学期,月５時限,3-608(演習室),わが国の経済社会は、高度成長の終焉、ﾊﾞﾌﾞﾙの形成と崩壊、その後の長期停滞、......
2021,POLX644G,国際政治演習Ｂ（中村英俊）,中村　英俊,経研,秋学期,月５時限,3-710,"春学期に引き続き、各自の研究報告を重ねてもらう。
　修士課程1年生については......"
2021,ECNT621L,離散変量分析（片山東）,片山　東,経研,秋学期,月５時限,11-601(第1ｺﾝﾋﾟｭｰﾀ教室),実証分析の基本的手法である「線形回帰分析」は、従属変数が離散的である場合に......
2021,HUMA690S,体温・体液生理学ゼミ（１）　Ｂ,永島　計,人研,秋学期,月５時限,研究室,　体温、体液に関する研究方法を習得し、かつ最新の知見を学ぶ。基本的な生理学......
2021,HUMA690S,食品生命科学ゼミ（１）　Ｂ,原　太一,人研,秋学期,月５時限,研究室,　食品科学や生命科学分野の基礎と応用研究に必要な知識と実験技術を習得する。......
2021,HUMA690S,言語情報科学ゼミ（１）　Ｂ,菊池　英明,人研,秋学期,月５時限,研究室,　音声言語の理解・生成・インタラクションなどのモデル構築およびその応用を目......
2021,HUMA690S,言語情報科学ゼミ（１）　Ｄ,菊池　英明,人研,秋学期,月５時限,研究室,　音声言語の理解・生成・インタラクションなどのモデル構築およびその応用を目......
2021,HUMA690S,知識情報科学ゼミ（１）　Ｂ,松居　辰則,人研,秋学期,月５時限,研究室,　知識情報科学ゼミ(1)Bは、知識情報科学ゼミ(1)Aの継続になります。各自の研究......
2021,HUMA690S,知識情報科学ゼミ（１）　Ｄ,松居　辰則,人研,秋学期,月５時限,研究室,　知識情報科学ゼミ(1)Dは、知識情報科学ゼミ(1)Cの継続になります。各自の研究......
2021,HUMA690S,地域資源論ゼミ（２）　Ｂ,柏　雅之,人研,秋学期,月５時限,100-303,　農村再生戦略と政策システムの論理と方法について学ぶ。わが国の内発的な農村......
2021,HUMA690S,国際社会学ゼミ（２）　Ｂ,樋口　直人,人研,秋学期,月５時限,研究室,　大学院のゼミは、学術論文の基礎となる水準の修士論文の執筆を目標として進め......
2021,HUMA690S,歴史人類学ゼミ（２）　Ｂ,里見　龍樹,人研,秋学期,月５時限,研究室,　ゼミ（１）Ａ・Ｂおよび（２）Ａで行った作業に基づき、修士論文を実際に書き......
2021,HUMA690S,学校カウンセリング学ゼミ（２）　Ｂ,桂川　泰典,人研,秋学期,月５時限,101-205,　学校カウンセリング学ゼミ（１）の理解を基盤に、ゼミ内の討論を通してリサー......
2021,HUMA690S,行動臨床心理学ゼミ（２）　Ｂ,嶋田　洋徳,人研,秋学期,月５時限,101-303,　行動臨床心理学ゼミ（１）を基礎として、そのエビデンスを重視しながら、各受......
2021,HUMA690S,医療心理学・職場メンタルヘルス学ゼミ（２）　Ｂ,鈴木　伸一,人研,秋学期,月５時限,101-209,　うつ病、不安症、心身症などのさまざまなストレス関連疾患の発症・維持・悪化......
2021,HUMA690S,行動医学ゼミ（２）　Ｂ,熊野　宏昭,人研,秋学期,月５時限,101-302,　ゼミ（１）を基礎として、各受講者の研究テーマについて、関連する先行研究の......
2021,HUMA690S,神経・生理心理学ゼミ（２）　B,田山　淳,人研,秋学期,月５時限,研究室,神経・生理心理学を心理臨床場面に応用するため、臨床場面での心と神経・生理の......
2021,HUMA690S,行動分析学ゼミ（２）　B,大月　友,人研,秋学期,月５時限,研究室,行動分析学ゼミ（１）を基礎にしながら、受講生それぞれの研究テーマに関して、......
2021,HUMA690S,発達臨床心理学ゼミ（２）　B,大森　幹真,人研,秋学期,月５時限,研究室,発達障害児における教育・実践・臨床現場での諸問題をテーマに演習を行なう。発......
2021,HUMA690S,心理学的支援論ゼミ（２）　B,井合　真海子,人研,秋学期,月５時限,研究室,心理学的支援ゼミ（１）を基礎として、修士研究の計画・立案を行い、それを全体......
2021,HUMA690S,学習環境デザイン論ゼミ（２）　Ｂ,尾澤　重知,人研,秋学期,月５時限,研究室,　学習環境デザイン論ゼミ(2)では、学習環境デザイン研究と、経営学で用いられ......
2021,HUMA600L,質的調査法特論,藤間　公太,人研,秋学期,月５時限,100-505,　社会調査の方法には、量的調査と質的調査とがある。量的調査に統計学的知識が......
2021,HUMA600L,生活支援工学特論,巖淵　守,人研,秋クォーター,月５時限,101-307,　人は誰しも加齢に伴い、身体や認知面に何らかの障がいを抱える。現在利用可能......
2021,HUMA600L,福祉工学特論,藤本　浩志,人研,冬クォーター,月５時限,保留,福祉工学とは，様々な研究領域を学際的に統合して，高いQOLの実現を目指す領域......
2021,INTA681W,ライティング＆リサーチ・スキル03(J),芦田　明美,アジア研,秋学期（アジア）,月５時限,19-314,本講義では、学術的文章とは分かりやすく、思考の整理された、科学的な文章であ......
2021,HSSM606S,運動代謝学演習（１）Ｂ,宮下　政司,スポーツ研,秋学期,月５時限,研究室,　運動代謝学演習（１）では、質の高い修士論文を作成するために必要な知識と応......
2021,HSSE637S,バイオメカニクス演習（１）Ｂ,矢内　利政,スポーツ研,秋学期,月５時限,研究室,　バイオメカニクスに関連する分野における研究デザインや方法論について理解し......
2021,HSST682S,コーチング心理学演習（１）Ｂ,堀野　博幸,スポーツ研,秋学期,月５時限,79-305講義室,　「トップパフォーマンス構築」と「育成年代の選手育成」では、コーチング対象......
2021,HSSC658S,スポーツ社会学演習（２）Ｂ,中澤　篤史,スポーツ研,秋学期,月５時限,研究室,　スポーツ・身体・人間に関連する社会現象を、社会学を中心とした社会科学的ア......
2021,HSSC646S,舞踊論演習（２）Ｂ,杉山　千鶴,スポーツ研,秋学期,月５時限,研究室,演習（２）Aでは、１つの問題に対し、多様な視点から見つめること、そして文献......
2021,HSSB606L,スポーツビジネス法特論,松本　泰介,スポーツ研,秋学期,月５時限,79-205大教室,　スポーツ実務において発生している具体的な事例を題材としながら、スポーツ法......
2021,HSSTZ04L,コーチ学特論,奥野　景介／礒　繁雄／射手矢　岬／倉石　平／杉山　千鶴／土屋　純／藤田　善也／堀野　博幸／松井　泰二,スポーツ研,秋クォーター,月４-５,100-201,　コーチングの対象者はレベル、種目など多様である。本講座では、コーチング現......
2021,INFO212L,ソフトウェア開発技術β　０１,井上　健,グローバル,秋クォーター,月４-５,24-503(Bﾙｰﾑ),ソフトウェア開発技術は21世紀の中心になる技術の一つであり、今後のソフトウェ......
2021,LANE205F,Academic Writing and Discussion in English　α　５９,ウェナーマーク　エリック　ピータ,グローバル,秋クォーター,01:月５時限02:木５時限,01:7-503演習室02:7-503演習室,AWADEは最大12名の少人数クラスでアカデミックライティングとディスカッション......
2021,LANE205F,Academic Writing and Discussion in English　α　６０,ゲンチ　ブルジュ,グローバル,秋クォーター,01:月５時限02:木５時限,01:14-610(ｾﾞﾐ室3)02:7-302,AWADEは最大12名の少人数クラスでアカデミックライティングとディスカッション......
2021,LANE205F,Academic Writing and Discussion in English　α　６１,ダー　ジョナサン　リチャード,グローバル,秋クォーター,01:月５時限02:木５時限,01:10-30502:7-509演習室,AWADEは最大12名の少人数クラスでアカデミックライティングとディスカッション......
2021,LANE205F,Academic Writing and Discussion in English　α　６２,ドイチェマン　サラ　ミヨシ,グローバル,秋クォーター,01:月５時限02:木５時限,01:14-609(ｾﾞﾐ室2)02:14-609(ｾﾞﾐ室2),AWADEは最大12名の少人数クラスでアカデミックライティングとディスカッション......
2021,LANE205F,Academic Writing and Discussion in English　α　６３,マッキンタイヤー　ロバート　アラン,グローバル,秋クォーター,01:月５時限02:木５時限,01:8-41702:11-915(演習室),AWADEは最大12名の少人数クラスでアカデミックライティングとディスカッション......
