
2021,EDUX702S,社会教育学研究演習（Ｄ-１）（前田）,前田　耕司,教研,春学期,金１時限,14-809(院生指導室),本授業は全回リアルタイム配信型授業(（Zoomによる同時双方向のライブ配信）と......
2021,MATX799S,解析学研究演習（Ｄ-１）（戸松）,戸松　玲治,教研,春学期,金１時限,14-807共同利用研究室8,"関数解析学と作用素環論の発展的内容を学びます．
作用素環とは、位相をもった......"
2021,PSYX652S,学校カウンセリングの理論と技術　Ｂ,高橋　あつ子,教研,春学期,金１時限,14-604,学校で教師が行う教育相談や生徒指導の全体像を、児童・生徒の今日的課題に照ら......
2021,HUMA690S,森林環境科学ゼミ（１）　A,平塚　基志,人研,春学期,金１時限,研究室,森林減少・劣化といった森林分野における諸課題は、同時に林産物の持続的な生産......
2021,HUMA690S,大気環境科学ゼミ（１）　Ａ,松本　淳,人研,春学期,金１時限,研究室,　大気環境科学分野に関する各自の修士課程での研究を遂行するために、輪読や論......
2021,HUMA690S,健康管理医学ゼミ（１）　Ａ,河手　典彦,人研,春学期,金１時限,研究室,　健康管理医学ゼミの根幹は、“Medical Aspects of Health Maintenance”にあり......
2021,HUMA600L,保健医療福祉文献検索評価法,扇原　淳,人研,春クォーター,金１時限,101-306,　疫学の基本的知識およびEvidence based Healthcareの考え方に加えて、多種多......
2021,ECNT620L,政策評価のための計量分析入門 (J),坂上　勝基,アジア研,春学期（アジア）,金１時限,19-708,データの利用可能性が増大するなか、合理的根拠（エビデンス）に基づいた政策形......
2021,ECNA631L,アジア太平洋におけるエネルギー問題 (J),武石　礼司,アジア研,春クォーター,金１-２,19-710,エネルギー問題は、世界の経済、政治、地球環境、企業など、あらゆる分野と密接......
2021,LAWB421L,基礎会社法I　Ｂ,大塚　英明,法務研,春学期,金１時限,27-201,　もともと会社法は、六法の一つである「商法」という法律から独立して単行法に......
2021,HSSB658S,スポーツビジネスマーケティング演習（１）Ａ,松岡　宏高,スポーツ研,春学期,金１時限,79-602演習室,　本演習では、スポーツマーケティングをテーマとした研究論文を精読し、検討し......
2021,HSST648S,走運動・コーチング科学演習（１）Ａ,礒　繁雄,スポーツ研,春学期,金１時限,100-204,　スポーツ種目の中の個人種目（陸上競技）を対象に、実験手法や発表等の演習指......
2021,HSST644S,トップスポーツコーチング科学演習（１）Ａ,奥野　景介,スポーツ研,春学期,金１時限,研究室,　現代社会に機能する「コーチング」をスポーツ・教育の分野より科学的に、また......
2021,ELCX65ZL,Power Systems Engineering,喜久里　浩之,先進研,春学期,金１時限,53-203教室,持続可能な社会の実現には，クリーンで経済的かつ安定したエネルギーネットワー......
2021,LNGA685S,International Communications and Culture I S (Second Language Education),ドゥテ　シルヴァン　マッチュウ　ジュリアン,国際コミ研,春学期,金１時限,11-801(演習室),"This class will be face-to-face on campus this semester



This seminar is......"
2021,CMMM601L,マーケティング（全日制）,澁谷　覚,経管研,春学期,金１時限,3-602,"<Learning Objectives>
デジタル時代のマーケティングを理解すること

Cr......"
2021,ECNA621G,Seminar on Economics(Research Guidance)[MSc in Finance],蟻川　靖浩,経管研,春学期,金１時限,26-303, 
2021,ECNA621G,Seminar in Market Microstructure(Research Guidance)(Spring)[MSc in Finance],宇野　淳,経管研,春学期,金１時限,26-603(PCﾙｰﾑ),Provide an advice and instruction to students according to their thesis topic.
2021,ECNA621G,Seminar on Portfolio Management(Research Guidance)[MSc in Finance],竹原　均,経管研,春学期,金１時限,26-301, 
2021,LANC201F,中国語コミュニケーション　初中級　α　０１,村上　公一,グローバル,春クォーター,金１-２,26-402,中国語圏で日常生活を送るのに最低限必要なトピックを扱う。中国語のコミュニケ......
2021,LANC201F,中国語コミュニケーション　初中級　β　０１,村上　公一,グローバル,夏クォーター,金１-２,26-402,中国語圏で日常生活を送るのに最低限必要なトピックを扱う。中国語のコミュニケ......
2021,HPEX101W,カバディ　０１,星川　秀利,グローバル,春学期,金１時限,37号館 早稲田ｱﾘｰﾅ B2F(ﾒｲﾝｱﾘｰﾅ),　カバディはインド・ウエストベンガル地方を中心として発展してきたアジア生ま......
2021,HPEX101W,ゴルフ　基礎　０１,土屋　圭吾,グローバル,春学期,金１時限,上石神井ｺﾞﾙﾌ練習場,　ゴルフは今や幅広い健康ニーズの中で、レクリエーションとして、又、生涯スポ......
2021,HPEX101W,サッカー　基礎　０１,堀野　博幸,グローバル,春学期,金１時限,東伏見ｻｯｶ―場,　人工芝の素晴らしいグランドで、サッカーがしたい！そんなサッカー大好きな学......
2021,HPEX101W,卓球　基礎　０１,下山　茂巳,グローバル,春学期,金１時限,17号館 体育館 3階 301 卓球場,"※2021年春期授業について※
コロナウイルスの感染状況によっては、授業の方法・......"
2021,HPEX101W,バスケットボール　基礎　０１,戸坂　勝,グローバル,春学期,金１時限,37号館 早稲田ｱﾘｰﾅ B2F(ﾒｲﾝｱﾘｰﾅ),　バスケットボールは、走る、跳ぶ、投げる、という運動を含み、瞬発力、持久力......
2021,HPEX101W,健康のためのレクリエーション　０１,沖田　祐蔵,グローバル,春学期,金１時限,17号館 体育館 B1 103 ﾌｪﾝｼﾝｸﾞ場,　生涯にわたる健康的なライフスタイルを獲得するためには、楽しみながらからだ......
2021,ECNT111L,経済と倫理　１,兼田　麗子／篠田　徹,グローバル,春クォーター,金１時限,3-703,グローバル化、人口構造の変化、格差、公平、再分配、他者への共感など、我々は......
2021,ECNT112L,経済と倫理　２,兼田　麗子／篠田　徹,グローバル,夏クォーター,金１時限,3-703,グローバル化、人口構造の変化、格差、公平、再分配、他者への共感など、我々は......
