
2021,BSPX101S,基礎演習　３３,笠松　学,政経,春学期,木４時限,3-301,ようこそ、早稲田大学政治経済学部へ。新入生のみなさんは、新しい生活の始まり......
2021,BSPX101S,基礎演習　４２,川口　浩,政経,春学期,木４時限,3-601,ようこそ、早稲田大学政治経済学部へ。新入生のみなさんは、新しい生活の始まり......
2021,BSPX101S,基礎演習　５０,高橋　遼,政経,春学期,木４時限,7-304,ようこそ、早稲田大学政治経済学部へ。新入生のみなさんは、新しい生活の始まり......
2021,GENX201S,アカデミックリテラシー演習（経済思想史入門）　０１,坂本　達哉,政経,春学期,木４時限,3-402,１．経済学・経済思想の歴史は様々な角度から学ぶことが出来る。シュンペーター......
2021,GENX201S,アカデミックリテラシー演習（情報数学（数理ゲーム理論入門））　０１,瀧澤　武信,政経,春学期,木４時限,10-305,1960年代から研究が開始され，1970年代にカリフォルニア大学のE. Berlekamp教授......
2021,LANE101F,"英語Reading（Language, Economics, and Politics）中級　０２組",川手ミヤジェイエフスカ　恩,政経,春学期,01:月４時限02:木４時限,01:10-20502:10-204,"In the opinion of many, reading is the single most important skillrequired......"
2021,LANE101F,"英語Reading（Language, Economics, and Politics）中級　０５組",トクマ　ウォン,政経,春学期,01:月４時限02:木４時限,01:3-30502:3-909実習室,"In the opinion of many, reading is the single most important skillrequired......"
2021,LANE101F,"英語Reading（Language, Economics, and Politics）準上級　０３組",ブリンクマン　ブルース,政経,春学期,01:月４時限02:木４時限,01:3-60602:3-405,"In the opinion of many, reading is the single most important skillrequired......"
2021,LANE101F,"英語Reading（Language, Economics, and Politics）準上級　０７組",ディオリオ　ギャレット,政経,春学期,01:月４時限02:木４時限,01:10-20202:3-302,"In the opinion of many, reading is the single most important skillrequired......"
2021,LANE101F,"英語Reading（Language, Economics, and Politics）準上級　０８組",フィールゼンド　テリー　キース,政経,春学期,01:月４時限02:木４時限,01:3-70402:10-306,"In the opinion of many, reading is the single most important skillrequired......"
2021,BSPX101S,基礎演習　３３,笠松　学,政経,春学期,木４時限,3-301,ようこそ、早稲田大学政治経済学部へ。新入生のみなさんは、新しい生活の始まり......
2021,BSPX101S,基礎演習　４２,川口　浩,政経,春学期,木４時限,3-601,ようこそ、早稲田大学政治経済学部へ。新入生のみなさんは、新しい生活の始まり......
2021,BSPX101S,基礎演習　５０,高橋　遼,政経,春学期,木４時限,7-304,ようこそ、早稲田大学政治経済学部へ。新入生のみなさんは、新しい生活の始まり......
2021,GENX201S,アカデミックリテラシー演習（経済思想史入門）　０１,坂本　達哉,政経,春学期,木４時限,3-402,１．経済学・経済思想の歴史は様々な角度から学ぶことが出来る。シュンペーター......
2021,GENX201S,アカデミックリテラシー演習（情報数学（数理ゲーム理論入門））　０１,瀧澤　武信,政経,春学期,木４時限,10-305,1960年代から研究が開始され，1970年代にカリフォルニア大学のE. Berlekamp教授......
2021,LANE101F,"英語Reading（Language, Economics, and Politics）中級　０２組",川手ミヤジェイエフスカ　恩,政経,春学期,01:月４時限02:木４時限,01:10-20502:10-204,"In the opinion of many, reading is the single most important skillrequired......"
2021,LANE101F,"英語Reading（Language, Economics, and Politics）中級　０５組",トクマ　ウォン,政経,春学期,01:月４時限02:木４時限,01:3-30502:3-909実習室,"In the opinion of many, reading is the single most important skillrequired......"
2021,LANE101F,"英語Reading（Language, Economics, and Politics）準上級　０３組",ブリンクマン　ブルース,政経,春学期,01:月４時限02:木４時限,01:3-60602:3-405,"In the opinion of many, reading is the single most important skillrequired......"
2021,LANE101F,"英語Reading（Language, Economics, and Politics）準上級　０７組",ディオリオ　ギャレット,政経,春学期,01:月４時限02:木４時限,01:10-20202:3-302,"In the opinion of many, reading is the single most important skillrequired......"
2021,LANE101F,"英語Reading（Language, Economics, and Politics）準上級　０８組",フィールゼンド　テリー　キース,政経,春学期,01:月４時限02:木４時限,01:3-70402:10-306,"In the opinion of many, reading is the single most important skillrequired......"
2021,LANE201F,English Language Course (Business English)　０５,堀江　洋文,政経,春学期,01:水４時限02:木４時限,01:3-70302:3-704,　‘Business English’， previously called ‘English Correspondence’ in the f......
2021,LANE201F,English Language Course (Business English)　０６,内野　泰子,政経,春学期,01:月４時限02:木４時限,01:3-70202:3-306,　This course is intended for intermediate-level students who are interest......
2021,LANE201F,English Seminar (Going Beyond Text-Based Academic Discourse)　０２,クリスティー　スティーヴ・ジョン,政経,春学期,木４時限,10-105,As the world increasingly engages in digital communications since the adve......
2021,LANE201F,English Seminar (Topics in US History)　０１,増田　正子,政経,春学期,木４時限,3-703,The United States is a nation of diverse peoples of immigrant descent. The......
2021,LANG101F,独語（中級）I　０２組,小笠原　能仁／グラスミュック　マルクス,政経,春学期,01:木４時限02:火５時限,01:10-40302:10-101,"○ 独語中級I（春学期）
　 「初級I」「初級II」で得た基礎的能力をもとに、それ......"
2021,LANG101F,独語（中級）I　０３組,齋藤　正樹／グラスミュック　マルクス,政経,春学期,01:木４時限02:火３時限,01:10-40702:10-406,"○ 独語中級I（春学期）
　 「初級I」「初級II」で得た基礎的能力をもとに、それ......"
2021,LANG101F,独語（中級）II　０４組,齋藤　正樹／グラスミュック　マルクス,政経,春学期,01:木４時限02:火３時限,01:10-40702:10-406,"○ 独語中級I（春学期）
　 「初級I」「初級II」で得た基礎的能力をもとに、それ......"
2021,LANG201F,インテンシブ独語（中級）I　０１組,長谷川　悦朗／グラスミュック　マルクス／生駒　美喜／赤松　エンリコ,政経,春学期,01:水４時限02:火４時限03:木４時限04:月４時限,01:3-705(演習室)02:10-10103:3-202(CTLT Classroom2)04:3-712(演習室),"○ 独語インテンシブ中級I（春学期）・インテンシブ中級II（秋学期）
　週4回の......"
2021,LANG201F,インテンシブ独語（中級）I　０２組,荻野　静男／赤松　エンリコ／ニッケル　フランク,政経,春学期,01:火３時限02:月５時限03:木４時限04:水４時限,01:3-70302:3-712(演習室)03:10-10104:3-909実習室,"○ 独語インテンシブ中級I（春学期）・インテンシブ中級II（秋学期）
　週4回の......"
2021,LANF101F,インテンシブ仏語（初級）I　０１組,佐道　直身／北村　喜久子／篠原　洋治／ボォ・小林　シルヴィ,政経,春学期,01:火４時限02:木４時限03:月４時限04:水４時限,01:10-20702:3-60203:3-80804:3-809,"インテンシブ初級Ⅰ・初級Ⅱ 
週4コマのインテンシブ・コースです。うち2コマでは......"
2021,LANF101F,インテンシブ仏語（初級）I　０２組,佐道　直身／岡本　健／大善　哲郎／ジュンタ　レナ,政経,春学期,01:月４時限02:水４時限03:木４時限04:火４時限,01:10-40202:10-10703:10-40604:11-606,"インテンシブ初級Ⅰ・初級Ⅱ 
週4コマのインテンシブ・コースです。うち2コマでは......"
2021,LANF101F,仏語（中級）I　０５組,佐道　直身／岡本　健,政経,春学期,01:木４時限02:月５時限,01:10-20702:10-107,"中級Ⅰ・中級Ⅱ 
中級Ⅰ（春学期）においては、週2コマのうち1コマでは、まず文法......"
2021,LANF201F,インテンシブ仏語（中級）I　０１組,松浦　寛／北村　喜久子／大善　哲郎／ブロッソー　シルヴィ,政経,春学期,01:金４時限02:月４時限03:火４時限04:木４時限,01:3-40402:3-30603:10-40704:3-304,"インテンシブ中級Ⅰ・中級Ⅱ 
週4コマでフランス語を集中的に学びます。うち2コマ......"
2021,LANF301F,仏語実践演習I　０２,Ｃ．Ａ．ペリセロ,政経,春学期,木４時限,10-206,Toutes les semaines nous allons discuter sur un thème de société français.
2021,LANC101F,中国語（初級）I　０１組,中島　祝／段　文凝,政経,春学期,01:月３時限02:木４時限,01:3-71002:7-205,　政治経済学部には、下記の中国語科目が設置されている。中国語の発音、文法、......
2021,LANC101F,インテンシブ中国語（初級）I　０１組,平林　宣和／孫　キ,政経,春学期,01:火３時限02:木４時限03:水４時限04:金４時限,01:3-903(学部PCﾙｰﾑ)02:3-903(学部PCﾙｰﾑ)03:3-903(学部PCﾙｰﾑ)04:3-903(学部PCﾙｰﾑ),政治経済学部には、下記の中国語科目が設置されている。中国語の発音、文法、語......
2021,LANC101F,インテンシブ中国語（初級）I　０２組,大久保　洋子／申　亜敏,政経,春学期,01:月４時限02:水５時限03:火３時限04:木４時限,01:3-40402:3-60603:10-30604:10-202,政治経済学部には、下記の中国語科目が設置されている。中国語の発音、文法、語......
2021,LANC101F,中国語（中級）I　０４組,関　浩志／陳　力衛,政経,春学期,01:木４時限02:水１時限,01:10-20302:3-710,　政治経済学部には、下記の中国語科目が設置されている。中国語の発音、文法、......
2021,LANC201F,インテンシブ中国語（中級）I　０２組,波多野　眞矢／張　継浜,政経,春学期,01:火３時限02:木４時限03:月３時限04:水３時限,01:3-70202:3-50103:3-50204:3-801,　政治経済学部には、下記の中国語科目が設置されている。中国語の発音、文法、......
2021,LANR101F,露語（初級）II　０２組,中澤　朋子,政経,春学期,01:木４時限02:土３時限,01:3-805(演習室)02:3-605,露語初級Ⅰ・露語初級Ⅱロシア語をはじめて学ぶ学生を対象とし、ロシア語の文字と......
2021,LANR101F,インテンシブ露語（初級）I　０１組,小林　昭菜／松本　隆志／クロチコフ　ユーリー／木村　英明,政経,春学期,01:火４時限02:月３時限03:木４時限04:水５時限,01:3-805(演習室)02:3-708(演習室)03:3-811(演習室)04:3-609(演習室),インテンシブ・コースを選択した学生のためのクラスで、『ロシア語をはじめよう......
2021,LANR101F,露語（中級）I　０１組,粕谷　典子,政経,春学期,01:火３時限02:木４時限,01:10-20302:3-712(演習室),露語中級Ⅰ：ロシア語作文と社会科学系の文献講読を、並行して学ぶ。週の前半で......
2021,LANR101F,露語（中級）II　０２組,木村　英明,政経,春学期,01:火４時限02:木４時限,01:3-914実習室02:3-708(演習室),露語中級Ⅰ：ロシア語作文と社会科学系の文献講読を、並行して学ぶ。週の前半で......
2021,LANS101F,西語（初級）I　０１組,木下　雅夫／ゴンサーレス　アフエラ　ベゴーニャ,政経,春学期,01:木４時限02:火４時限,01:10-40202:3-502,週２回の授業を２名の教員（日本人教員とネイティヴ教員）が担当します。初級I......
2021,LANS101F,インテンシブ西語（初級）I　０２組,本谷　裕子／Ｏ．Ｖ．パルマ／久野　悠／石原　セルヒオ,政経,春学期,01:木４時限02:月４時限03:水４時限04:金４時限,01:3-60602:3-40603:3-70104:3-306,週４回の授業のうち２回は日本人教員、２回はネイティヴ教員が担当します。日常......
2021,LANS101F,西語（中級）I　０１組,久野　悠／ゴンサーレス　アフエラ　ベゴーニャ,政経,春学期,01:木４時限02:火３時限,01:3-70102:3-402,「初級I」「初級II」で得た基礎的能力をもとに、それをさらに発展させて用いる......
2021,POLX309S,政治学演習 I (福田耕治),福田　耕治,政経,春学期,木４時限,3-709,　グローバル化に伴い、国民国家の枠を超えて行政の活動領域も拡大する傾向にあ......
2021,POLX309S,政治学演習 I (笹田栄司),笹田　栄司,政経,春学期,木４時限,3-802,　行政や国会に比べ変わることのなかった司法制度は、20世紀末に始まる改革によ......
2021,POLX409S,政治学演習 III (中村英俊),中村　英俊,政経,春学期,木４時限,3-808,　「グローバルなリベラル秩序」が流動化している。EU・ヨーロッパ統合（ブレグ......
2021,POLX409S,政治学演習 III (稲村一隆),稲村　一隆,政経,春学期,木４時限,3-702,政治哲学は社会の規範的な原理について探究する学問です。特に自由主義と民主主......
2021,ECNA399S,経済学演習 I (金子昭彦),金子　昭彦,政経,春学期,木４時限,3-807(演習室),経済学演習Iでは、下記の教科書を利用し国際金融及び国際貿易の基礎を学ぶ。そ......
2021,ECNA399S,経済学演習 I (片山宗親),片山　宗親,政経,春学期,木４時限,3-710,本演習では、日本経済やアメリカ経済などを中心にマクロ経済に関する諸問題（金......
2021,ECNT399S,経済学演習 I (上條良夫),上條　良夫,政経,春学期,木４時限,3-502,一連の演習（I〜I V）は、実験経済学および行動経済学に関する卒業論文を執筆す......
2021,ECNA499S,経済学演習 III (齊藤有希子),齊藤　有希子,政経,春学期,木４時限,3-605,現実社会において、空間経済学がどのような示唆を与えうるのか、興味のあるテー......
2021,ECNT499S,経済学演習 III (小林和夫),小林　和夫,政経,春学期,木４時限,3-810(演習室),私たちが生きている現在の世界は、どのようにして形成されたのだろうか。このよ......
2021,POLX309S,国際政治経済学演習 I (久米郁男),久米　郁男,政経,春学期,木４時限,3-801,　この演習の目標は日常起こっている様々な現象を政治学的に考える訓練を行うこ......
2021,ECNA339S,国際政治経済学演習 I (小西秀樹),小西　秀樹,政経,春学期,木４時限,3-902(学部PCﾙｰﾑ),秋学期からの演習IIで実証論文を読みこなしていくために，演習Iでは，計量経済......
2021,ECNT399S,国際政治経済学演習 I (戸堂康之),戸堂　康之,政経,春学期,木４時限,3-406,この演習では、経済成長論、国際経済学、開発経済学を主たるツールとして、日本......
2021,JOUX309S,ジャーナリズム・メディア演習 I (齊藤泰治),齊藤　泰治,政経,春学期,木４時限,3-401,本演習は「ジャーナリズム・メディア演習」として設置されており、中国に関して......
2021,JOUX309S,ジャーナリズム・メディア演習 I (高橋恭子),高橋　恭子,政経,春学期,木４時限,3-809,私たちは、インターネットによって新たなコミュニケーションの場や機会を生み出......
2021,GENX409S,学際領域演習 III (岡本暁子),岡本　暁子,政経,春学期,木４時限,10-201,ヒトを含む地球上の生き物は、何千万年何億年という時間をかけて変化し、まわり......
2021,GENX201S,Intermediate Seminar (Sustainable Finance)　０１,小枝　淳子,政経,春学期,木４時限,10-102,This course reviews the existing goals and challenges as well as financial......
2021,GENX301S,Advanced Seminar III　０１,ケラム　マリサ,政経,春学期,木４時限,3-706(演習室),Comparative politics is the subfield of political science that explains re......
2021,GENX301S,Advanced Seminar III　０２,戸村　肇,政経,春学期,木４時限,10-106,"In this course, students read a classic written by Barry Eichengreen on Gr......"
2021,GENX301S,Advanced Seminar III　０４,浅古　泰史,政経,春学期,木４時限,3-609(演習室),The topic and the lecture style will be decided by students in my Advanced......
2021,GENX301S,Advanced Seminar III　０７,下川　哲,政経,春学期,木４時限,3-711(演習室),This seminar introduces intermediate economic theory and econometric metho......
2021,GENX301S,Advanced Seminar III　０８,ジョウ　ウィリー,政経,春学期,木４時限,3-604(演習室),This seminar explores the phenomenon of changes in political values: where......
2021,GENX301S,Advanced Seminar III　０９,河村　耕平,政経,春学期,木４時限,3-608(演習室),This seminar is primarily for students who intend to write an undergraduat......
2021,GENX301S,Advanced Seminar III　１０,クヴァソフ　デミトリ,政経,春学期,木４時限,3-607(演習室),Study of game-theoretic tool their applications to a variety of issues in ......
2021,GENX301S,Advanced Seminar III　１１,上田　路子,政経,春学期,木４時限,7-419,Continuation of Advanced Seminar 2 (contact the instructor for details)
2021,POLX231L,Comparative Politics of Western Europe　０１,日野　愛郎,政経,春学期,木４時限,7-310,This course is designed to give an overview of the field of comparative po......
2021,LAWH101S,導入演習（必修）　１,愛敬　浩二,法学,春学期,木４時限,10-301,授業実施方法：対面を原則としつつ、リアルタイム配信を併用する。ただし、状況......
2021,LAWH101S,導入演習（必修）　６,尾形　祥,法学,春学期,木４時限,8-B106,授業実施方法（対面式）本演習は、商事法（商法、会社法など）を素材として、初......
2021,ARTF101L,映像論 I　 （谷）,谷　昌親,法学,春学期,木４時限,8-B102,"本科目は以下の形態による授業を実施します。
【対面】
　みなさんは、映像とい......"
2021,LNGI101L,言語学 I　Ａ （首藤）,首藤　佐智子,法学,春学期,木４時限,8-308,食事に誘った友達から「明日英語の試験がある」と言われたら、あなたはどう解釈......
2021,PHLR101L,宗教学 I　 （加藤）,加藤　之晴,法学,春学期,木４時限,8-106,「科学技術が極限にまで発展した現代においても、じつは宗教は私たちの生活に深......
2021,LANE201Z,English: Theme ３９（春）,鈴木　武生,法学,春学期,木４時限,6-315演習室,本プログラムは、単に英語を学ぶのではなく、さまざまなトピックについて書かれ......
2021,LANG201F,独語中級 I（総合）　４（春）,岡山　具隆,法学,春学期,木４時限,8-406,【授業実施方法については、初回授業時に各教員に確認してください】この授業で......
2021,LANF201F,仏語中級 I（文法・作文）  １（春）,中村　隆之,法学,春学期,木４時限,3-305,授業実施方法　リアルタイム配信＋対面授業（基本はリアルタイム配信を考えてい......
2021,LANC201F,中国語中級 I（ｺﾐｭﾆｹｰｼｮﾝ）　３（春）,王　傑,法学,春学期,木４時限,8-311,この科目は中国語の中級レベルを目指す学生のための授業である。授業では、日常......
2021,LAWC321L,少年法,吉開　多一,法学,春学期,木４時限,11-505,【授業実施方法】オンデマンド（事前収録）と対面を組み合わせた反転授業形式を......
2021,LAWG241L,租税法総論 I,渡辺　徹也,法学,春学期,木４時限,8-B101,　租税法総論および租税実体法（主として所得税と法人税）に関する主要な制定法......
2021,LAWF321L,社会保障法I,菊池　馨実,法学,春学期,木４時限,8-B107, 超高齢社会の到来を迎え、年金・医療・介護・貧困・少子化問題など、社会保障......
2021,LAWD311L,外国法特論（英米法）I Ａ,宮川　成雄,法学,春学期,木４時限,8-105,　アメリカの移民法をその歴史と人権規範の観点から検討する。アメリカは移民国......
2021,LAWB311S,主専攻法学演習（民法）  Ｊ （春）,鎌野　邦樹,法学,春学期,木４時限,8-417,　民法の重要判例を素材として、民法解釈学の基本的な思考方法を習得することを......
2021,LAWB311S,主専攻法学演習（民法）  Ｋ （春）,後藤　巻則,法学,春学期,木４時限,15-02,　この演習では、民法財産法上の諸問題を考察の対象にします。１年を２期に分け......
2021,LAWB331S,主専攻法学演習（民事訴訟法）  Ｂ （春）,内田　義厚,法学,春学期,木４時限,8-402,実務法曹(裁判官・検察官・弁護士)を本格的に目指す学生を対象として、法科大学......
2021,LAWB331S,主専攻法学演習（民事訴訟法）  Ｄ （春）,勅使川原　和彦,法学,春学期,木４時限,10-103,　前期は、基本事項についての私の講義ないし上級生の報告発表をしばらく行ない......
2021,LAWC311S,主専攻法学演習（刑事法）  Ｆ （春）,田山　聡美,法学,春学期,木４時限,7-207,刑事法の重要論点について、各回、報告担当者を決めて、その報告をベースに全員......
2021,LAWC331S,主専攻法学演習（刑事法）  Ｐ （春）,小川　佳樹,法学,春学期,木４時限,10-307,　この授業では、刑事訴訟法の基本判例・重要判例の検討を行います。教材に掲載......
2021,LAWC311S,主専攻法学演習（刑事法）  Ｑ （春）,杉本　一敏,法学,春学期,木４時限,8-403,刑法総論・各論の重要論点に関する判例、又は、最新の判例等を素材にして、報告......
2021,LAWE311S,主専攻法学演習（国際法）　Ｂ （春）,古谷　修一,法学,春学期,木４時限,8-411,　この演習は、国際社会のさまざまな事象に対して、国際法がどのように機能して......
2021,LAWA311S,主専攻法学演習（憲法）  Ｅ （春）,水島　朝穂,法学,春学期,木４時限,8-310,　憲法の動態的研究を行う。憲法判例を検討する場合にも、ただ単に判例要旨に簡......
2021,LAWA321S,主専攻法学演習（行政法）  Ｄ （春）,田村　達久,法学,春学期,木４時限,8-404,　我が国の行政法学上の重要なテーマに関して、グループ報告とそれに基づく議論......
2021,LAWB321S,主専攻法学演習（商法）  Ｋ （春）,箱井　崇史,法学,春学期,木４時限,8-309,　このゼミでは、商法に関して近時の裁判例などに現れた重要問題について研究し......
2021,LAWG321S,主専攻法学演習（知的財産権法）Ａ （春）,安藤　和宏,法学,春学期,木４時限,10-205,本講義は、近年の著作権法・商標法・不正競争防止法をめぐる重要論点について、......
2021,LAWG321S,主専攻法学演習（知的財産権法）Ｃ （春）,高林　龍,法学,春学期,木４時限,8-312,現実に生じた問題（判例）や学生が作成した架空事例を通じて知的財産権法をめぐ......
2021,LAWF311S,主専攻法学演習（労働法）  Ａ （春）,大木　正俊,法学,春学期,木４時限,8-401,　多くの人は労働者として働くことで日々の生活の基礎となる収入を得ています。......
2021,GDRX101L,ジェンダー・スタディーズＩ（身近なことを視座にして）,金井　景子,教育,春学期,木４時限,15-102,　「ジェンダーって何！」というごく初歩的な疑問から出発して、自身の中に深く......
2021,LANE201F,英語中級コンプリヘンション（文化）　１　Ｄ,大石　瑶子,教育,春学期,木４時限,16-506,本授業では、William Shakespeare の Macbeth を扱います。Macbeth は優れた将......
2021,LANE204F,英語中級コミュニケーション　１　Ｏ,谷　佐保子,教育,春学期,木４時限,16-304,1.    本授業は初回のガイダンス、中間発表、期末発表の準備、および発表の計4......
2021,LANE306F,英語上級コミュニケーション １３　α,ケイ・ハスキー,教育,春学期,木４時限,16-303,The primary aim of this course is to provide students with opportunities t......
2021,TCPX101L,法律学　Ａ,北山　雅昭,教育,春学期,木４時限,16-704,本講義では、法や法的事象（法の形成、維持・運用、改変にかかわる諸々の活動の......
2021,TCPX101L,教職概論（中・高）　Ｇ,佐藤　千津,教育,春学期,木４時限,15-202,【重要】2021年度は、オンライン授業（全回オンデマンド配信）として開講する。......
2021,TCPX107L,教育心理学（中・高）　Ｋ,上淵　寿,教育,春学期,木４時限,14-402,教育心理学は「ひとはいかに学びいかに覚えるか」「難しい問題をどのように解く......
