
2021,ARTH699G,美術史学研究指導５-1　Ｍ,児嶋　由枝,文研,春学期,木４時限,39-2205児嶋由枝研究室,　ルネサンス・バロック美術史学ならびにその周辺領域に関する学術研究の基本を......
2021,ARTH611S,美術史学演習７-1,山本　聡美,文研,春学期,木４時限,31-306研究指導室,　古代・中世絵画（仏画、掛幅画、絵巻、障屏画）を調査・研究するに際して必要......
2021,HISA699G,日本史学研究指導１-1　Ｍ,伊川　健二,文研,春学期,木４時限,31-202,　日本近世史の分野から修士論文の課題を設定し、修論準備報告を行う。課題の設......
2021,HISA699G,日本史学研究指導７-1　Ｍ,藤野　裕子,文研,春学期,木４時限,31-305研究指導室,　各自の研究テーマに即して、問題意識、先行研究の整理、使用史料、研究視角・......
2021,HISA631S,日本史学演習１-1,伊川　健二,文研,春学期,木４時限,31-202,　近世の対外交流において送受信された人・物・情報に関わる史料を、受講者各自......
2021,HISA641S,日本史学演習７-1,藤野　裕子,文研,春学期,木４時限,31-305研究指導室,　本演習では、近現代日本史研究における司法史料に関する研究文献と史料の輪読......
2021,HISB699G,東洋史学研究指導２-1　Ｍ,柿沼　陽平,文研,春学期,木４時限,32-227,　修士論文作成に対する論文指導
2021,HISB699G,東洋史学研究指導３-1　Ｍ,飯山　知保,文研,春学期,木４時限,32-321-2,　各自の報告をもとに自由討論をする。
2021,HISB611S,東洋史学演習２-1,柿沼　陽平,文研,春学期,木４時限,32-227,　本授業では戦国秦漢時代の出土文字資料を読む。本年度はとくに睡虎地秦簡「為......
2021,HISB611S,東洋史学演習３-1,飯山　知保,文研,春学期,木４時限,32-321-2,　受講生各自が輪番に自分の研究課題と関係する史料を提示し、その史料に即して......
2021,HISE611S,西洋史学演習２-1,井上　文則,文研,春学期,木４時限,31-309研究指導室,　6世紀の東ゴート王国時代のラテン語史料である著者不明の『テオドリック大王......
2021,ARCX699G,考古学研究指導７-1　Ｍ,高橋　龍三郎,文研,春学期,木４時限,31-302研究指導室,　修士論文を作成するに当たって、目標の設定、資料の検索、資料の操作と検討、......
2021,ARCX631S,考古学演習７-1,高橋　龍三郎,文研,春学期,木４時限,31-302研究指導室,　大学院生の個別の研究テーマはそれぞれ異なり、個別の対応は不可能なので、全......
2021,CMFE699G,表象・メディア論研究指導６-1　Ｍ,坂内　太,文研,春学期,木４時限,33-1115坂内 太研究室,　修士論文の作成を目的とし、各学生の研究成果報告をもとに議論を重ねる。
2021,CMFE699G,表象・メディア論研究指導８-1　Ｍ,宮沢　章夫,文研,春学期,木４時限,31-313研究指導室,　文化の多様性、世界の多様性に着目し、様々な芸術・文化（演劇／映画／文学／......
2021,CMFE631SARTT631SARTF631S,表象・メディア論演習６-1,坂内　太,文研,春学期,木４時限,33-1115坂内 太研究室,　アイルランドの演劇・文学には変身や不可視などの特殊な身体表象が重要なテー......
2021,CMFE631S,表象・メディア論演習８-1,宮沢　章夫,文研,春学期,木４時限,31-313研究指導室,　文化の多様性、世界の多様性に着目し、様々な芸術・文化（演劇／映画／文学／......
2021,CMFE699G,現代文芸研究指導３-1　Ｍ,小野　正嗣,文研,春学期,木４時限,33-705文芸･ｼﾞｬｰﾅﾘｽﾞﾑ論系室3,　修士論文の準備状況について、随時面接を行い、指導を行う。
2021,CMFE651S,現代文芸演習３-1,小野　正嗣,文研,春学期,木４時限,33-705文芸･ｼﾞｬｰﾅﾘｽﾞﾑ論系室3,"　文学や美術について書かれた英語圏のテクストを全員で精読する。
　毎回、担......"
2021,ARTT681SLITJ681S,Japan's Living Theater,高井　詩穂,文研,春クォーター,01:月４時限02:木４時限,01:32-32402:32-324,"　In this course, we will consider the representations of different types ......"
2021,SOCX799G,社会学研究指導８-1　Ｄ,大久保　孝治,文研,春学期,木４時限,39-2318大久保孝治研究室,　学生の研究テーマに合わせて、ライフストーリー・データ（質的データ）の有効......
2021,SOCX799G,社会学研究指導１０-1　Ｄ,山田　真茂留,文研,春学期,木４時限,39-2315山田真茂留研究室,　研究指導を行う。
2021,EDUX799G,教育学研究指導６-1　Ｄ,阿比留　久美,文研,春学期,木４時限,33-1311阿比留 久美研究室,　博士論文作成状況ならびに関連する研究・学会活動・社会実践について確認し、......
2021,LITJ799G,日本文学研究指導５-1　Ｄ,和田　琢磨,文研,春学期,木４時限,32-225,　日本中世文学のうち、軍記物語・説話文学を中心とした散文作品の研究指導を行......
2021,LITC799G,中国語学研究指導２-1　Ｄ,内藤　正子,文研,春学期,木４時限,39-2410内藤正子研究室,　博士論文の作成に向けて、各自の論文の発表と討議を行う。
2021,ARTH799G,美術史学研究指導２-1　Ｄ,肥田　路美,文研,春学期,木４時限,31-301研究指導室,　個人指導の形式で実施。博士学位請求論文の作成に関する指導を中心に、学会で......
2021,ARTH799G,美術史学研究指導５-1　Ｄ,児嶋　由枝,文研,春学期,木４時限,39-2205児嶋由枝研究室,　博士論文作成に向けての個別指導を実施する。同時に、学会誌への投稿、学会で......
2021,HISA799G,日本史学研究指導５-1　Ｄ,川尻　秋生,文研,春学期,木４時限,39-2611川尻秋生研究室,　課程博士を取得することを目指して、大学院生を指導する。そのためには、題材......
2021,ANTC799G,文化人類学研究指導１-1　Ｄ,箕曲　在弘,文研,春学期,木４時限,33-1509箕曲 在弘研究室,　博士論文の完成に向けて、受講生の研究計画の立案、理論的・方法論的課題につ......
2021,MANX731L,Research in Strategic Management　,山野井　順一,商研,夏クォーター,01:木３時限02:木４時限,01:11-1111(指導室)02:11-1111(指導室),This Ph.D. course provides an overview of researchstreams in strategic man......
2021,MANX711L,Research in Organization Theory　,三橋　平,商研,春クォーター,01:木３時限02:木４時限,01:22-50402:22-504,"※本講義は、履修者に応じて、日本語も英語も使用します。
※対面授業を想定して......"
2021,MANX611S,経営組織演習,大月　博司,商研,春学期,木４時限,11-1141(指導室),近年、組織を取り巻く環境は予想をはるかに超えるスピードで変化している。その......
2021,ACCX641S,会計情報演習,大鹿　智基,商研,春学期,木４時限,11-1110(指導室),　本演習は，主として会計情報に対する株式市場の反応を実証的に分析することを......
2021,MANX691G,組織・戦略研究指導　（Ｍ）,藤田　誠,商研,春学期,木４時限,11-1105(指導室),"本指導では、修士論文作成について指導する。
各人がﾃｰﾏを選定し、それに対応し......"
2021,ECNA651G,産業組織論研究指導　（Ｍ）,加納　和子,商研,春学期,木４時限,11-1112(指導室),履修者は実証ミクロ経済学の分野における研究テーマを設定し、中間報告論文を作......
2021,MANX721G,組織行動・人的資源管理研究指導　（Ｄ）,竹内　規彦,商研,春学期,木４時限,11-1248研究室, 
2021,EDUX603S,社会教育学演習（Ｍ１-１）（矢口）,矢口　徹也,教研,春学期,木４時限,16-710(演習室),  本演習は、社会教育学の主たる領域である女性教育、青少年教育に関する具体的......
2021,EDUX604L,教育史特論Ａ,湯川　次義,教研,春学期,木４時限,16-301,本講義では、近代及び戦後教育改革期の女性の大学教育をめぐる展開を対象にする......
2021,EDUX60ZL,比較教育学特論Ａ,長島　啓記,教研,春学期,木４時限,16-708,16州から構成される連邦制国家であるドイツの教育制度の現状について、社会的・......
2021,EDUX612S,国語科教育演習（Ｍ２-１）（町田）,町田　守弘,教研,春学期,木４時限,14-508共同利用研究室3,　中学校・高等学校現場での魅力ある効果的な国語科教材の発掘と国語科授業の創......
2021,LITJ622S,国文学演習（古典文学）（Ｍ１-１）（福家）,福家　俊幸,教研,春学期,木４時限,16-502-1,"この演習は中古文学専攻の者を主な対象とする。
　主として物語，日記など中古......"
2021,LITJ642S,国文学演習（古典文学）（Ｍ１-１）（中嶋）,中嶋　隆,教研,春学期,木４時限,16-402-1,『武道色八景』五巻五冊は、宝永二年刊、桃林堂蝶麿作・鳥居清信画の江戸版浮世......
2021,LITJ662S,国文学演習（近代文学）（Ｍ１-１）（五味渕）,五味渕　典嗣,教研,春学期,木４時限,16-610,　現在、日本近代文学研究で取り上げられている対象は多岐にわたる。対象や問題......
2021,LNGF624S,英語科教育演習（Ｍ２-１）（澤木）,澤木　泰代,教研,春学期,木４時限,16-712(演習室),修士２年生のゼミでは、輪読形式で第二言語習得や英語教育・評価に関する様々な......
2021,LNGT686S,英語学演習（Ｍ２-１）（久野）,久野　正和,教研,春学期,木４時限,16-713(演習室),修士論文執筆に向けてテーマの設定、文献リストの作成、執筆を段階的に指導をす......
2021,ECNT601G,経済学研究指導（Ｍ-１）（熊谷）,熊谷　善彰,教研,春学期,木４時限,熊谷善彰研究室,株式・債券・為替・商品などの市場の価格変動メカニズムの分析、企業・家計など......
2021,HISA686L,歴史学特論ＩV-1（日本近世史）,大橋　幸泰,教研,春学期,木４時限,22-618,歴史学特論Ⅲ-1･Ⅲ-2に引き続き、日本近世史の諸問題について、共通の研究文献(ま......
2021,LNGF723S,英語科教育研究演習（Ｄ-１）（原田）,原田　哲男,教研,春学期,木４時限,16-825研修室,This course covers various topics on English pronunciation required for bo......
2021,MATX722S,トポロジー研究演習（Ｄ-１）（谷山）,谷山　公規,教研,春学期,木４時限,14-813(院生指導室),学生の研究テーマに関してセミナー形式で演習を行う。関連する結び目理論，空間......
2021,MATX799S,解析学研究演習（Ｄ-１）（梁）,梁　松,教研,春学期,木４時限,14-805共同利用研究室6,"解析学、確率論とその関連分野に関する研究指導を行う。
本授業は、全回リアル......"
2021,EDUX602S,カリキュラム・マネジメントの理論と実践　Ａ,根津　朋実,教研,春クォーター,木３-４,16-406,・教育課程とカリキュラムとの異同を前提に、学習指導要領に登場した「カリキュ......
2021,EDUX603S,学級経営の実践力研究　Ｃ,小山　利一,教研,夏クォーター,木４時限,16-504,学校経営にかかわる実践上の課題と方策を理解し、学級経営の実践力を培う。授業......
2021,EDUX684S,心理教育的アセスメントと個別の指導計画（心理的アセスメントに関する理論と実践）　Ａ,バーンズ亀山静子／高橋　あつ子,教研,春学期,木４時限,16-105,LD、ADHD、自閉スペクトラム症（ASD）等、特別な支援を要する児童生徒は、校種......
2021,HUMA690S,技術史・技術文化論ゼミ（１）　Ａ,余語　琢磨,人研,春学期,木４時限,研究室,　人間が物質的存在（道具・生産物、身体、環境資源など）に何かを働きかけるに......
2021,HUMA690S,緩和医療学・臨床死生学ゼミ（１）　Ａ,小野　充一,人研,春学期,木４時限,101-305,　緩和医療学については、個人の“死”とその過程で生ずるつらさを具体的に和らげ......
2021,HUMA690S,インターネット科学ゼミ（１）　Ａ,西村　昭治,人研,春学期,木４時限,研究室,　インターネット科学を学ぶにあたって必要な基本的なスキルを身に付けることに......
2021,HUMA690S,ネットワーク情報システム学ゼミ（１）　Ａ,金　群,人研,春学期,木４時限,100-201,　情報処理の基礎理論・方法について学ぶ。利用者の振る舞いを考慮した学際的統......
2021,HUMA690S,ネットワーク情報システム学ゼミ（１）　Ｃ,金　群,人研,春学期,木４時限,100-201,　最新のコンピューティング・ネットワーク技術について学ぶ。利用者の振る舞い......
2021,HUMA690S,建築計画学ゼミ（２）　Ａ,佐野　友紀,人研,春学期,木４時限,研究室,　建築、都市の計画を主眼として、諸問題を解決するための実践的な調査、実験、......
2021,HUMA690S,建築計画学ゼミ（２）　Ｃ,佐野　友紀,人研,春学期,木４時限,研究室,　建築、都市の計画を主眼として、諸問題を解決するための実践的な調査、実験、......
2021,HUMA690S,社会文化心理学ゼミ（２）　Ａ,古山　宣洋,人研,春学期,木４時限,100-303,　知覚行為・相互行為・コミュニケーションにおける身体性の問題を、生態心理学......
2021,HUMA690S,パフォーマンス認知科学ゼミ（２）　Ａ,三浦　哲都,人研,春学期,木４時限,研究室,本ゼミではパフォーマンス認知科学における主要な生体計測方法の原理、解釈方法......
2021,HUMA690S,人間生体機能動態学ゼミ（２）　Ａ,宮崎　正己,人研,春学期,木４時限,研究室,　修士論文作成のための基本的な事柄（知識・実験手法）に関して習得をすすめていく。
2021,ARSE687L,タイ資料研究 I(E),村嶋　英治,アジア研,夏クォーター,木３-４,19-512,This class is designed for students who have sufficient knowledge of Thai ......
2021,LAWE612L,国際紛争と法の支配(E),河野　真理子,アジア研,春学期（アジア）,木４時限,8-604,"In the current circumstances of the Asian region, disputes concerning mari......"
2021,POLX763G,現代朝鮮半島研究、北東アジアの国際関係（研究指導）,李　鍾元,アジア研,春学期（アジア）夏学期（アジア）,01:木４時限02:無その他,19-609,　この授業では、博士後期課程の演習として、文献調査方法や学術論文の様式など......
2021,INFJ611L,制約処理論,吉江　修,情シス研,春学期,木４時限,ｺﾝﾋﾟｭｰﾀ実習室2,論理によるモデル化手法について解説する。そのために必要な論理学の基礎、コン......
2021,PCSX644S,生産プロセス工学演習B,立野　繁之,情シス研,春学期,木４-５,ｾﾞﾐ室C-1,受講者に生産プロセス工学に関する課題（現代信頼性、情報設備診断などの支援シ......
2021,ELCX624S,無線通信回路技術演習B,吉増　敏彦,情シス研,春学期,木４-５,学生室,"無線通信部において、重要な役割を担う「発振器」に関して、
1) 低位相雑音発振......"
2021,INFC617S,高位検証技術演習C,木村　晋二,情シス研,春学期,木４時限,講義室11,システムLSIの高位設計と検証について、文献調査を中心にしながら、簡単な回路......
2021,ELCX622L,レーザ工学,硴塚　孝明,情シス研,春学期,木４時限,講義室1,レーザは光通信、光記録、センシング、加工等の様々な分野で産業応用される。本......
2021,LAWC613L,刑法総合I　Ｄ,北川　佳世子,法務研,春学期,木４時限,27-202,【概要】本講義は、刑法総論に関する重要な刑事判例を素材として、事案解決能力......
2021,LAWB632L,民事訴訟法総合I　Ｂ,菅原　郁夫,法務研,春学期,木４時限,27-206,この科目は、民事訴訟法の手続全般について，判例を中心に基礎知識の定着を図り......
2021,LAWB632L,民事訴訟法総合I　Ｅ,高田　昌宏,法務研,春学期,木４時限,27-203,この科目は、民事訴訟法の手続全般について，判例を中心に基礎知識の定着を図り......
2021,LAWA621L,行政法　Ｃ,人見　剛,法務研,春学期,木４時限,27-201,国会の定める法律を基礎に展開される行政活動の過程を、法規や通達を作成する過......
2021,LAWB686L,倒産法I　Ａ,山本　研,法務研,春学期,木４時限,27-306,　「倒産法」は実定法の名称ではないが、破産法、民事再生法、会社更生法、会社......
2021,LAWG654L,医事法II,甲斐　克則,法務研,春学期,木４時限,8-405,　ポストゲノム社会における医療と法に関する刑事法的側面に焦点を当てて、医事......
2021,LAWD685L,司法制度の基礎理論　Ａ,石田　京子,法務研,春学期,木４時限,27-302,本講義は、司法制度の基本的機能とその現代的課題、およびこれに携わる専門家の......
2021,LAWD614L,外国法基礎（中国法）,文　元春,法務研,春学期,木４時限,27-305,本講義は基本的に、対面により実施することを考えているが、新型コロナウイルス......
2021,ACCX612L,財務会計Ａ（１）　※短答免除対象科目【財】　※SOA VEE該当科目,川村　義則,会計研,春クォーター,木４-５,11-901(指導室),　本講義では、現行の企業会計制度における具体的な会計処理の説明に加えて、基......
2021,ACCX613L,財務会計各論I　※短答免除対象科目【財】,川村　義則,会計研,夏クォーター,木４-５,11-901(指導室),財務会計における多様な問題をいくつかの基本的な視点から整理し、知識の体系化......
2021,HSSC658S,スポーツ史演習（１）Ａ,石井　昌幸,スポーツ研,春学期,木４時限,79-702演習室,　各自個別研究を行い、その成果を発表し、ディスカッションと教員の指導によっ......
2021,HSSB658S,Sport Management (Seminar 1) A,松岡　宏高／佐藤　晋太郎／ウォン　ドナ,スポーツ研,春クォーター,木４-５,79-602演習室,  This course is designed to provide master’ s candidates with knowledge o......
2021,HSSB658S,Sport Management (Seminar 1) B,松岡　宏高／佐藤　晋太郎／ウォン　ドナ,スポーツ研,夏クォーター,木４-５,79-602演習室,  This course is designed to provide master’ s candidates with knowledge o......
2021,HSSM653L,Human Anatomy 1,杉本　大輔,スポーツ研,春クォーター,木３-４,100-114,This is a human anatomy I. This course consists of didactic lecture with i......
2021,HSSM653L,Human Anatomy 2,杉本　大輔,スポーツ研,夏クォーター,木３-４,100-114,This is a human anatomy II. This course consists of didactic lecture with ......
2021,ACCX621L,Managerial Accounting (管理会計)（全日制）,ラオ　デイヴィッド,経管研,夏クォーター,木３-４,26-302,"In this course, we will learn the basic functions and importance of the ro......"
2021,MANX631L,General Management（総合経営）（全日制）,菅野　寛,経管研,春クォーター,木３-４,11-903(馬蹄形),"Course outline

Note: This course will be held in English.

What is “gen......"
2021,MANX621L,グローバル・ビジネス・リーダーの育成と活用,大滝　令嗣,経管研,春クォーター,木３-４,11-902(馬蹄形),企業のグローバル化の方法論と、それを担うグローバルリーダー人材をどうやって......
2021,MANX621L,Human Resource Development of Global Business Leader (グローバル・ビジネス・リーダーの育成と活用),大滝　令嗣,経管研,夏クォーター,木３-４,11-903(馬蹄形),The course is designed to give students better understanding of the busine......
2021,MANX631L,Dialogue with Top Entrepreneurs in Japan,入山　章栄,経管研,夏クォーター,木３-４,11-902(馬蹄形),"In this course, we invite 7 top young entrepreneurs who are currently inno......"
2021, ,サービス・マーケティング＆マネジメント,木村　達也,経管研,夏クォーター,木３-４,7-201,本講義では、ビジネスの競争優位の源泉としてのサービスを考えます。「製造業に......
2021,ECNT611L,Advanced Microeconomics,蟻川　靖浩,経管研,春クォーター,木３-４,26-302,This is an advanced microeconomics course. The material covered in this co......
2021,ECNA621L,Real Estate Finance　,川口　有一郎,経管研,夏クォーター,木３-４,26-603(PCﾙｰﾑ),This course aims to provide students with concepts and techniques for anal......
2021,ECNA621S,Seminars on Risk Management[MSc in Finance],チェン　ミンヤン　ウィリアム,経管研,春学期,木４時限,26-301, 
2021,INFY101L,情報科学の基礎　０２,高橋　優,グローバル,春クォーター,木３-４,24-502(Aﾙｰﾑ),　コンピュータは情報収集やコミュニケーションのツールとして日常生活にすっか......
2021,INFY101L,情報科学の基礎　０３,高橋　優,グローバル,夏クォーター,木３-４,24-502(Aﾙｰﾑ),　コンピュータは情報収集やコミュニケーションのツールとして日常生活にすっか......
2021,INFJ101L,ネットワーク技術初級　０１,中村　優一,グローバル,春クォーター,木３-４,24-503(Bﾙｰﾑ),本授業ではコンピュータネットワークを支えるネットワーク技術について、初学者......
2021,INFJ211L,ネットワーク技術準中級　０１,中村　優一,グローバル,夏クォーター,木３-４,24-503(Bﾙｰﾑ),本授業ではコンピュータネットワークを支えるネットワーク技術について、ネット......
2021,INFN107L,クライアントサイドWebプログラミング初級　０１,齋藤　恵,グローバル,夏クォーター,木３-４,24-601(Cﾙｰﾑ),"本講義ではプログラミングの授業として、JavaScript初級レベルを学びます。
主......"
2021,INFN105L,プログラミング初級（Python）　０１,石田　崇,グローバル,春クォーター,木３-４,14-603(教育実験室),Python言語を使用してプログラム作成から実行までの基本的な流れ，プログラミン......
2021,INFN105L,プログラミング初級（Python）　０２,石田　崇,グローバル,夏クォーター,木３-４,14-603(教育実験室),Python言語を使用してプログラム作成から実行までの基本的な流れ，プログラミン......
2021,INFC102L,コントラクトブリッジで学ぶ数理科学入門　０１,並木　亮／瀧澤　武信,グローバル,春クォーター,木３-４,24-602(講義室),※本講座は公益社団法人日本コントラクトブリッジ連盟（JCBL）の協力に基づいて......
2021,LANE205F,Academic Writing and Discussion in English　α　１２,ウェナーマーク　エリック　ピータ,グローバル,春クォーター,01:月４時限02:木４時限,01:11-915(演習室)02:7-503演習室,AWADEは最大12名の少人数クラスでアカデミックライティングとディスカッション......
2021,LANE205F,Academic Writing and Discussion in English　α　１３,ゲンチ　ブルジュ,グローバル,春クォーター,01:月４時限02:木４時限,01:14-610(ｾﾞﾐ室3)02:14-610(ｾﾞﾐ室3),AWADEは最大12名の少人数クラスでアカデミックライティングとディスカッション......
2021,LANE205F,Academic Writing and Discussion in English　α　１５,ベイ　シャローム,グローバル,春クォーター,01:月４時限02:木４時限,01:7-503演習室02:7-509演習室,AWADEは最大12名の少人数クラスでアカデミックライティングとディスカッション......
2021,LANE205F,Academic Writing and Discussion in English　α　１６,アペール　ランディ　フレッド,グローバル,春クォーター,01:月４時限02:木４時限,01:7-30202:7-302,AWADEは最大12名の少人数クラスでアカデミックライティングとディスカッション......
2021,LANE205F,Academic Writing and Discussion in English　α　２４,マッキンタイヤー　ロバート　アラン,グローバル,春クォーター,01:月４時限02:木４時限,01:7-20202:11-911(演習室),AWADEは最大12名の少人数クラスでアカデミックライティングとディスカッション......
2021,LANE303F,Academic Writing and Discussion in English　β　１２,ウェナーマーク　エリック　ピータ,グローバル,夏クォーター,01:月４時限02:木４時限,01:11-915(演習室)02:7-503演習室,AWADEは最大12名の少人数クラスでアカデミックライティングとディスカッション......
